S#,Title,Location,Date,Summary,Fatalities,Injured,Total victims,Mental Health Issues,Race,Gender,Latitude,Longitude
151,LaGrange,"LaGrange, Georgia",1/28/2015,"On January 28, 2015, in a Georgia home, a man shot three family members and one friend, and strangled his daughter in law. All five died. He left town with the family's dog, and police arrested him several days later.",5,0,5,No,White American or European American,Male,33.03607062,-85.0287065
152,Queens,"New York City, New York",1/24/2015,"Early in the morning of January 24, 2015, a man shot his two daughters, wife, and mother-in-law, killing all but one of his daughters. The shooter  then went to his car and shot himself.",4,1,4,No,Black American or African American,Male,40.68996411,-73.8720502
153,Omaha,"Omaha, Nebraska",1/24/2015,"On the morning of January 24, 2015, two shooters opened fire at a party outside a home in Omaha. Three were killed and five others were injured. One of the suspected shooters was arrested, but the other has not been identified. Possibly gang-related.",3,5,8,No,Black American or African American,Male,41.265922,-96.05381421
154,Moscow,"Moscow, Idaho",1/10/2015,"On Friday, January 10, 2015, a man shot his adoptive mother in her house, walked to his landlord's nearby office and shot and killed him and injured another person in the office. He then drove to an Arby's that his parents frequented, asked to see the manager, and shot and killed her. ",3,1,4,No,Asian American,Male,46.73059479,-116.9990042
155,Memphis,"Memphis, Tennessee",1/1/2015,"On Jan. 1, 2015, 25 people were on a party bus that was shot at by people in two vehicles that followed the bus. At least one of these men had been in a verbal argument with one of the bus' passengers at a club where the party bus had stopped just before the shooting.",0,5,5,No,Black American or African American,Male,35.10528976,-89.97734924
156,"Pennsburg, Souderton, Lansdale, Harleysville","Pennsburg, Souderton, Lansdale, Harleysville, Pennsylvania",12/15/2014,"Early in the morning on December 15, 2014, a man entered the Souderton home of his ex-wife's sister and killed her, her husband, and her two children. He then went to a Lansdale residence and shot his ex-wife's mother and grandmother. He proceeded to his ex-wife's home in Lower Salford where he fatally shot her and took their two daughters to another location. Nearly two days later the was found dead from a drug overdose.",7,1,7,Yes,White American or European American,Male,40.39359306,-75.49640881
157,Morgantown,"Morgantown, West Virginia",12/1/2014,"On December 1, 2014, a man entered the home of his ex-girlfriend and shot and killed her and her new boyfriend. He then proceeded to the home of a business rival, whom he killed, and the home of another man with whom his ex-girlfriend had been involved, whom he also killed. The shooter then drove to another county and shot himself.",5,0,4,No,White American or European American,Male,39.63400851,-79.94839325
158,Florida State University,"Tallahassee, Florida",11/19/2014,"On November 19 just after midnight,  a graduate of Florida State University went to a library on campus which was full of people. He opened fire, injuring three people. Police arrived and told the shooter to drop the weapon, but he refused. Police then fired at the shooter, killing him.",1,3,3,Yes,Black American or African American,Male,30.4549394,-84.25264151
159,Marysville-Pilchuck High School shooting,"Marysville, Washington",10/24/2014,"Jaylen Fryberg, 15, using a .40-caliber Berretta, shot five 
students at Marysville High School, including two of his cousins and three friends, killing all but one. Fryberg arranged to meet them for lunch in the school cafeteria by text. Fryberg was reportedly well-liked at the school and there was not believed to be any ill-will between him and his victims. He committed suicide at the scene.",5,1,6,Unclear,Native American,Male,48.050824,-122.176918
160,Marysville-Pilchuck High School,"Marysville, Washington",10/24/2014,"On October 24, 2014, a freshman at Marysville-Pilchuck High School approached a table of his friends in the school cafeteria and a verbal fight ensued. The student then pulled out a handgun and fired at the students at the table. He injured five students, killed 1 girl, and then committed suicide by shooting himself in the head. Three of the four injured students died in the hospital in the following days. ",5,1,5,No,Native American or Alaska Native,Male,48.04802409,-122.1359622
161,Albuquerque Auto Shop,"Albuquerque, New Mexico",8/8/2014,"The shooter pulled up to an auto shop and saw his ex-girlfriend talking with her current boyfriend. He crashed his car into the car the couple was standing next to. This knocked the current boyfriend to the ground. The shooter then fired fatal shots at his ex-girlfriend, and shot and injured three other women who had entered the shop.",2,3,4,No,Some other race,Male,35.15290522,-106.7791378
162,Bourbon Street New Orleans,"New Orleans, Louisiana",6/29/2014,"On June 29, 2014, two men were having an argument on Bourbon Street, which escalated into a gunfight. Many shots were fired into the surrounding crowd, killing one and injuring nine.",1,9,10,No,Two or more races,Male,30.0687242,-89.93147412
163,Nellis Plaza,"Las Vegas, Nevada",6/8/2014,"On the afternoon of June 8, 2014, a man and his wife approached two police officers having lunch in Las Vegas and began shooting, killing them both. The couple then fled to Walmart, where they killed an armed civilian attempting to stop the shooters. The man was killed by police and the woman killed herself at the Walmart.",5,0,3,No,White American or European American,Male/Female,36.18931923,-115.3264875
164,Seattle Pacific University,"Seattle, Washington",6/5/2014,"On June 5, 2014, a 26-year-old man entered a hall on the campus of Seattle Pacific University and began shooting at students. The shooter killed one student and injured two others before a student tackled and stopped the shooter as he was reloading.",1,2,3,Yes,Some other race,Male,47.62199575,-122.323646
165,Isla Vista mass murder,"Santa Barbara, California",5/23/2014,"Elliot Rodger, 22, shot three people to death in the college town of Isla Vista near the University of California, Santa Barbara. He also shot others as he drove around town, and injured others by striking them with is vehicle. He committed suicide by shooting himself in his car as police closed in. Prior to the rampage, Rodger stabbed three people to death at his apartment.",6,13,19,Yes,White,M,,
166,Isla Vista,"Isla Vista, California",5/23/2014,"On the evening of May 23, 2014, a 22-year-old student and resident of Isla Vista stabbed two roommates and their friend to death in his apartment. He then drove to a sorority house in Isla Vista and attempted to enter the premises to no avail, and began shooting at a neighboring sorority's members, killing two and wounding another. He continued shooting between altercations with police throughout Isla Vista, killing another male student and wounding six more before committing suicide. ",7,7,10,Yes,White American or European American,Male,34.4145857,-119.8581209
167,Kennesaw FedEx,"Kennesaw, Georgia",4/29/2014,"On the morning of April 29, 2014, a 19 year-old package handler at the FedEx in Kennesaw, Georgia arrived at his place of work and began shooting. He wounded six of his coworkers before committing suicide.",1,6,6,No,White American or European American,Male,34.02529674,-84.61766831
168,Fort Hood shooting 2,"Fort Hood, Texas",4/3/2014,"Army Specialist Ivan Lopez, 34, opened fire at the Fort Hood Army Post in Texas, killing three and wounding at least 12 others before shooting himself in the head after engaging with military police. Lt. Gen. Mark A. Milley told reporters that Lopez ""had behavioral health and mental health"" issues.",3,12,15,Unclear,Latino,M,,
169,Fort Hood,"Killeen, Texas",4/2/2014,"On April 2, 2014, a 34-year-old Army Specialist began shooting at Fort Hood where he was stationed. He killed 3 military personnel and wounded 16 others before committing suicide. ",4,16,19,Yes,Some other race,Male,31.07925506,-97.73392317
170,San Francisco Tenderloin,"San Francisco, CA",3/23/2014,"On the evening of March 23, 2014, the shooters were arguing with a crowd outside of a club, which prompted them to retrieve arms from their car for the attack. Eight people were wounded by the attack, and there were no fatalities. The shooters were later apprehended.",0,8,8,No,Black American or African American,Male,37.75457839,-122.4424343
171,Alturas tribal shooting,"Alturas, California",2/20/2014,"Cherie Lash Rhoades, 44, opened fire at the Cedarville Rancheria Tribal Office and Community Center, killing four and wounding two. After running out of ammunition, Rhoades grabbed a butcher knife and stabbed another person.",4,2,6,Unknown,Native American,Female,41.487104,-120.542237
172,Cedarville Rancheria Tribe,"Alturas, California",2/20/2014,"On February 20, 2014, a 44-year old woman went to a tribe eviction meeting where she killed three family members and a worker. After running out of ammunition, the shooter grabbed a butcher knife and stabbed another person.",4,2,6,No,Native American or Alaska Native,Female,41.4911123,-120.549091
173,Centennial Hill Bar & Grill,"Montgomery, Alabama",12/28/2013,"Early morning on December 28, 2013, a rapper had a confrontation with an acquaintance before going onstage. Soon after, the acquaintance left and re-entered the building and fired at the rapper. He and another shooter injured 5 and killed 3, including the rapper.",3,5,8,No,Black American or African American,Male,32.34729571,-86.26730242
174,Los Angeles International Airport (LAX),"Los Angeles, California",11/1/2013,"On November 1, 2013, an unemployed 23-year old man entered Terminal 3 at Los Angeles International Airport (LAX) in California, and pulled a rifle from his bag, killing one TSA officer and wounding two other officers and a passenger before he was wounded and captured. Witnesses said that the shooter was calmly asking people: ""Hey, are you TSA?"". If they said no, the shooter moved on.",1,3,4,No,White American or European American,Male,34.17622092,-118.5399542
175,Sparks Middle School,"Sparks, Nevada",10/21/2013,"On October 21, 2013, a 12-year old student at Sparks Middle School in Nevada, shot and injured two students and killed a teacher before killing himself. ",2,2,3,Unknown,Some other race,Male,39.54058388,-119.748291
176,Washington Navy Yard shooting,"Washington, D.C.",9/16/2013,"Aaron Alexis, 34, a military veteran and contractor from Texas, opened fire in the Navy installation, killing 12 people and wounding 8 before being shot dead by police.",12,8,20,Yes,Black,Male,38.874981,-76.99453
177,Washington Navy Yard,Washington D.C.,9/16/2013,"On September 16, 2013, a 34-yearl old contractor for the Navy Yard in Washington D.C, entered the building shooting randomly, killing twelve people and injuring three surviving victims before he was shot and killed by law enforcement officers.  Five other people were injured during the incident while trying to escape.",13,3,15,Yes,Black American or African American,Male,38.90480894,-77.01629717
178,Oklahoma City Residence,"Oklahoma City, Oklahoma",8/14/2013,"On August 14, 2013, a 40-year old man obsessed with actress Selena Gomez, fatally shot his mother, sister, niece and infant nephew. He was later arrested and told police he had to getaway from his family because they were preventing him from being with his one true love.",4,0,4,Yes,White American or European American,Male,35.46779189,-97.5191631
179,Homes in Desoto and Dallas,"Dallas, Texas",8/7/2013,"On August 7, 2013, a 44-year old former special education teacher allegedly went on a murder spree in the Dallas area, killing four people, including his ex-wife and estranged girlfriend, and wounding four others. Once police arrived at the second home, the shooter after running out of ammunition, reportedly pretended he was one of the victims and appeared catatonic.",4,4,8,Unknown,Black American or African American,Male,32.79480596,-96.76631094
180,Ross Township Supervisor Council Meeting,"Salisbury , Pennsylvania",8/5/2013,"On August 5, 2013, an unemployed 59-year old man went to Ross Township's monthly meeting in Salisbury, Pennsylvania, killing three people and injuring four more. The shooter was later restrained and shot in the leg by civilians at the scene. He had been forced to vacate his property of 20 years and had been living out of his car and in abandoned buildings ever since.",3,3,6,No,White American or European American,Male,39.75344279,-79.08435956
181,Hialeah apartment shooting,"Hialeah, Florida",7/26/2013,"Pedro Vargas, 42, set fire to his apartment, killed six people in the complex, and held another two hostages at gunpoint before a SWAT team stormed the building and fatally shot him.",7,0,7,Unclear,Latino,Male,25.8670105,-80.29146268
182,Hialeah Apartments,"Hialeah, Florida",7/26/2013,"On July 26, 2013, a 42-year old man set fire to his apartment in Hialeah, Florida, and opened fire from his balcony and inside the apartment complex. Then he held two neighbors hostage during a stand-off with police until he was fatally shot by a SWAT team.",7,0,6,No,Some other race,Male,25.85294547,-80.28316975
183,Santa Monica rampage,"Santa Monica, California",6/7/2013,"John Zawahri, 23, armed with a homemade assault rifle and high-capacity magazines, killed his brother and father at home and then headed to Santa Monica College, where he was eventually killed by police.",6,3,9,Yes,White,Male,34.008617,-118.494754
184,Santa Monica College,"Santa Monica, California",6/7/2013,"On June 7, 2013, a 23-year old killed his father and brother at their family home and then set the home on fire in Santa Monica, California. He then forced a motorist to drive him to the Santa Monica College campus. On his way there he fired at commuters. During a 13-minute shooting spree spanning roughly 1.5 miles he killed three other people and three others wounded by gun shot. The shooter was killed by the police in the Santa Monica College library.",6,3,8,Yes,White American or European American,Male,34.02319149,-118.4815644
185,Village of Manchester in Illinois,"Manchester, Illinois",4/24/2013,"On April 24, 2013, a 43-year old man traveled to the home of his former partner's family in Manchester, Illinois. He shot and killed three adults (one  of them pregnant), a boy, and an infant, all members of the same family. There was a third child who, after shooting her, the shooter took to a neighbor's house; she survived the incident. The shooter was then chased by the police by car. The car chase resulted in a shootout between the two. The shooter was shot and killed by the police.",7,1,7,Unknown,White American or European American,Male,39.54231335,-90.33029852
186,Pinewood Village Apartment shooting,"Federal Way, Washington",4/21/2013,"Dennis Clark III, 27, shot and killed his girlfriend in their shared apartment, and then shot two witnesses in the building's parking lot and a third victim in another apartment, before being killed by police.",5,0,5,No,Black,Male,47.3129607,-122.3393665
187,Pinewood Village Apartments,"Federal Way, Washington",4/21/2013,"On April 21, 2013, a 27-year old man shot and killed his girlfriend at their apartment in Federal Way, Washington. He then shot two neighbors in the building's parking lot and a third victim in another apartment who had come out to see what was happening. It seems the shooter wanted to kill any witness after shooting his girlfriend. He was later killed by police.",5,0,4,Unknown,Black American or African American,Male,47.30909721,-122.3357553
188,Mohawk Valley shootings,"Herkimer County, New York",3/13/2013,"Kurt Myers, 64, shot six people in neighboring towns, killing two in a barbershop and two at a car care business, before being killed by officers in a shootout after a nearly 19-hour standoff.",5,2,7,No,White,Male,43.045601,-74.984891
189,Mohawk and Herkimer Villages in New York,"Mohawk, New York",3/13/2013,"On March 13, 2013, an unemployed 64-year old man set his apartment on fire in Mohawk village, New York, before he went into a local barbershop and shot four people, killing two and wounding two others. Afterwards, the shooter drove to Herkimer village, where he shot and killed to other people at a local car servicing business. After the rampage, he holed up in an abandoned building where he had a standoff with police for 18 hours until he was shot and killed.",5,2,6,No,White American or European American,Male,43.0104011,-75.0075119
190,"Ladera Ranch, Santa Ana, Tustin and Orange","Ladera Ranch, California",2/19/2013,"On February 19, 2013, a 20-year old unemployed, part-time student killed a 20-year old woman at his parent's house. The shooter's parents called 911 when they heard the noise. He drove off in his parents car and went on a killing spree carjacking several cars and shooting at commuters, drivers, and construction workers. He committed suicide when police were approaching. The shooter had left a suicide note that he wrote within an hour of the 911 call his parents made.",4,3,6,Yes,White American or European American,Male,33.54961059,-117.6415707
191,Los Angeles Police Department,"Irvine, California",2/3/2013,"On February 3, 2013, a 33-year old former LAPD police officer shot and killed the daughter of a former LAPD captain and her fiance in a parking garage in Irvine, California. The shooter fled the scene and a large manhunt followed until February 12, 2013, during a stand-off  with police at a cabin in the San Bernardino Mountains. The shooter killed one police officer and injured another one before he committed suicide. It is not clear if he took his life before or after the police started to burn down the cabin where he was holed up. ",4,2,7,Yes,Black American or African American,Male,33.67803464,-117.773628
192,Phoenix Law Firm,"Phoenix, Arizona",1/30/2013,"On January 30, 2013, a 70-year old man attended a mediation session at a law firm in Phoenix, Arizona. At the end of the session he shot three people at the entrance of the building, killing the two man involved in the session with him and wounding a third person. The shooter fled the scene, firing at a man who followed him. He later died from a self-inflicted gunshot wound.",3,1,3,Unknown,White American or European American,Male,33.57145875,-112.0904854
193,South Valley Residence,"South Valley, Albuquerque, New Mexico",1/19/2013,"On January 19, 2013, a 15-year old homeschooled student shot and killed his mother and three younger siblings in their residential home in South Valley, New Mexico. The shooter then waited up five hours for his father, a former pastor, to arrive home. When the father got home, the son shot him several times and killed him. Apparently, he was planning to go on a killing spree afterwards. Instead he went to church and was later arrested.",5,0,5,Yes,Some other race,Male,35.15290522,-106.7791378
194,Newtown school shooting,"Newtown, Connecticut",12/14/2012,"Adam Lanza, 20, shot his mother dead at their home then drove to Sandy Hook Elementary school. He forced his way inside and opened fire, killing 20 children and six adults before committing suicide.",28,2,30,Yes,white,Male,41.4123225,-73.31142358
195,Sandy Hook Elementary School,"Newtown, Connecticut",12/14/2012,"On December 14, 2012, a 20-year old shot and killed his mother at their home in Newtown, Connecticut. He then travelled to Sandy Hook Elementary School killing twenty children and six adult staff members and injuring two others before killing himself. Court documents showed that the school shooting had occurred in the space of less than five munities with 156 shots fired.",28,2,29,Yes,White American or European American,Male,41.41190846,-73.31196267
196,Clackamas Town Center,"Happy Valley, Oregon",12/11/2012,"On December 11, 2012, an unemployed 22-year old run into Clackamas Town Center, a shopping center outside the City of Portland, Oregon. The gunman opened fire on shoppers and employees killing two people and seriously wounding a third person before committing suicide.",3,1,3,No,Some other race,Male,45.44853107,-122.5440133
197,Azana Spa in Brookfield,"Brookfield, Wisconsin",10/21/2012,"On October 21, 2012, a 45-year old man went to Azana Spa in Brookfield, Wisconsin, where his estranged wife worked. He shot and killed his ex-wife and two of her co-workers and injured four others before committing suicide.",4,4,7,No,Black American or African American,Male,43.06396691,-88.12299758
198,The Spot Nightclub,"Miami, Florida",9/28/2012,"On September 28, shots were fired into a large crowd gathered at The Spot, an all-ages club at which many young teens were present. Fifteen people were injured.",0,15,15,Unknown,Black American or African American,Male,25.79653943,-80.20840397
199,Accent Signage Systems shooting,"Minneapolis, Minnesota",9/27/2012,"Andrew Engeldinger, 36, upon learning he was being fired, went on a shooting rampage, killing the business owner, three fellow employees, and a UPS driver. He then killed himself.",7,1,8,Yes,white,Male,44.9772995,-93.2654692
200,Accent Signage Systems in Minneapolis,"Minneapolis, Minnesota",9/27/2012,"On September 27, 2012, a 36-year old man recently fired at Accent Signage Systems in Minneapolis, went into the firm's building killing six people and injuring two others. The gunman then turned the gun on himself.",7,2,8,Yes,White American or European American,Male,44.96358722,-93.26783687
201,Sikh temple shooting,"Oak Creek, Wisconsin",8/5/2012,"U.S. Army veteran Wade Michael Page, 40, opened fire in a Sikh gurdwara before he died from a self-inflicted gunshot would during a shootout with police.",7,3,10,Yes,white,Male,42.8858503,-87.8631362
202,Sikh Temple in Wisconsin,"Oak Creek, Wisconsin",8/5/2012,"On August 5, 2012, a 40-year old US Army veteran and white supremacist opened fire in a Sikh Temple in Oak Creek, Wisconsin fatally shooting six people and wounded four others. The shooter took his life by shooting himself after he was shot in the stomach by a responding police officer. His girlfriend had broken up with him very recently.",7,4,10,No,White American or European American,Male,42.88027442,-87.90087079
203,Aurora theater shooting,"Aurora, Colorado",7/20/2012,"James Holmes, 24, opened fire in a movie theater during the opening night of ""The Dark Night Rises"" and was later arrested outside.",12,70,82,Yes,white,Male,39.709283,-104.823488
204,Movie Theater in Aurora,"Denver, Colorado",7/20/2012,"On July 20, 2012, a 24-year old student set off several gas or smoke canisters at a movie theater in Aurora, and then opened fire on the theater audience, killing twelve people and wounding fifty-eight. Moments after the shooting, police arrested the shooter next to his car behind the theater. Once apprehended, the shooter told the police that he had booby-trapped his apartment with explosive devices before heading to the theater.",12,58,70,Yes,White American or European American,Male,39.72941874,-104.9825207
205,University Heights Apartments in Auburn,"Auburn, Alabama",6/9/2012,"On June 9, 2012, a 22-year old man went to a party in an off-campus apartment complex in Auburn, Alabama. Three people, including two former Auburn University football players, were killed and three others were wounded. The shooter fled the scene and turned himself in a few days later.",3,3,6,Unknown,Black American or African American,Male,32.60598014,-85.48989253
206,Cafe in Seattle,"Seattle, Washington",5/30/2012,"On May 30, 2012, a 40-year old man went to a coffee shop in Seattle, Washington, where he was asked to leave due to his belligerent behaviour the previous week. The man opened fire and killed four people and injured another one. He then fled and later killed a female motorist, taking off with her SUV. Five hours later, while he was being confronted by police, he killed himself with a gunshot.",6,1,6,Yes,White American or European American,Male,47.62199575,-122.323646
207,Seattle cafe shooting,"Seattle, Washington",5/20/2012,"Ian Stawicki, 40, gunned down four patrons at a cafe, and another person during a carjacking nearby, then shot himself as police closed in. (He died later that day in a Seattle hospital.)",6,1,7,Yes,white,Male,47.6038321,-122.3300624
208,"North Tulsa, Oklahoma","Tulsa, Oklahoma",4/6/2012,"On April 6, 2012, a 19-year old and a 32-year old man went on a deadly shooting spree in Tulsa, Oklahoma, shooting black men at random in an apparently racially motivated attack. Three men died and two were wounded. The victims were chosen at random.",3,2,5,No,White American or European American,Male,36.13543238,-95.91316117
209,Oikos University killings,"Oakland, California",4/2/2012,"One L. Goh, 43, a former student, opened fire in a nursing classroom. He fled the scene by car and was arrested nearby a few hours later.",7,3,10,Yes,Asian,Male,37.8043808,-122.2708166
210,Oikos University,"Oakland, California",4/2/2012,"On April 2, 2012, a 43-year old former student at Oikos University, a Korean Christian college in Oakland, California, opened fired in a classroom killing seven people and injuring other three. The attacker continued to fire shots as he fled the campus, driving away in a car belonging to one of his victims. Hours later he surrendered to authorities.",7,3,10,Yes,Asian American,Male,37.79176806,-122.2153171
211,Chardon High School,"Chardon, Ohio",2/27/2012,"On February 27, 2012, a 17-year old student entered Chardon High School in Chardon, Ohio, shooting  students in the cafeteria and in the hallway, leaving three students dead and three injured. He then was chased out of the school by a teacher and was arrested outside the school.",3,3,6,Yes,White American or European American,Male,41.58025541,-81.20812625
